{
  "run_id": "",
  "created_at": "",
  "user_intent": "",
  "selected_mode": "",
  "selected_recipe": "",
  "selected_profiles": [],
  "selected_capabilities": [],
  "runtime_provenance": {
    "think_tank_runtime_used": false,
    "provider_policy_checked": false,
    "dispatch_decision_emitted": false,
    "provider_invoked": false,
    "result_recovered": false,
    "true_multi_agent_runtime": false,
    "execution_method": "protocol_only",
    "data_collection": "none",
    "evidence_state": "planned",
    "result_recovery": "none",
    "boundaries": []
  },
  "provider_invocation_ledger": {
    "entries": []
  },
  "evidence_refs": [],
  "conclusions": [],
  "disagreements": [],
  "risks": [],
  "next_actions": [],
  "post_run_curation": {},
  "memory_runtime": {
    "enabled": true,
    "memory_candidates": [],
    "promotion_decisions": [],
    "conflicts": [],
    "written": [],
    "skipped": [],
    "boundaries": []
  },
  "quality_check": {}
}
